cluster,post_count,top_keywords
0,43,"nlp emotion, emotion classification, text emotion, emotion lightweight, emotion speech"
1,50,"compete nvidia, nvidia blackwell, gpu cloud, nvidia ai, cloud gpu"
2,20,"ai laughing, ai artists, ai artist, art ai, ai image"
3,51,"tmlr papers, iclr papers, tmlr paper, best papers, papers better"
4,74,"decoder llms, llm interpretability, learning llms, interpretability transformer, embeddings lms"
5,27,"relu networks, learning relu, deep relu, relu softmax, relu nets"
6,107,"generative models, generative modeling, improving generative, generative representations, generative functionality"
7,30,"slm projects, creating slms, slms developer, slms architecture, build slms"
8,50,"llm pipelines, models pipelines, mlops pipeline, training pipeline, llm apis"
9,26,"search spy, spy searcher, spy search, searcher, search web"
10,119,"ai math, math ai, ai basics, learning math, learning mathematics"
11,95,"considering phd, industry phd, career advice, job prospects, career shift"
12,40,"built ai, ai company, ai developer, builder ai, engineer ai"
13,84,"avoid ai, ai encountering, ai social, promotes ai, preventing ais"
